{"$schema":"https://json-schema.org/draft/2020-12/schema","$id":"https://schemas.umh.dev/foundation/calendar/reservation.v1.schema.json","title":"Reservation","description":"Canonical reservation claim against calendar availability or capacity.","type":"object","additionalProperties":false,"required":["id","objectType","schema_version","calendar_ref","resource_ref","reserved_for_ref","status","start_at","end_at","timezone","quantity","created_at","updated_at","version"],"properties":{"id":{"type":"string","minLength":1},"objectType":{"const":"Reservation"},"schema_version":{"const":"1.0.0"},"calendar_ref":{"$ref":"https://schemas.umh.dev/foundation/envelopes/object-ref.v1.schema.json"},"resource_ref":{"$ref":"https://schemas.umh.dev/foundation/envelopes/object-ref.v1.schema.json"},"reserved_for_ref":{"$ref":"https://schemas.umh.dev/foundation/envelopes/object-ref.v1.schema.json"},"status":{"type":"string","enum":["held","confirmed","released","canceled","expired"]},"start_at":{"type":"string","format":"date-time"},"end_at":{"type":"string","format":"date-time"},"timezone":{"type":"string","minLength":1},"quantity":{"type":"integer","minimum":1},"hold_expires_at":{"type":"string","format":"date-time"},"created_at":{"type":"string","format":"date-time"},"updated_at":{"type":"string","format":"date-time"},"version":{"type":"integer","minimum":1},"extensions":{"type":"object","propertyNames":{"pattern":"^[a-z][a-z0-9-]*(\\.[a-z][a-z0-9-]*)*\\.v[0-9]+$"},"additionalProperties":true}},"x-umh":{"contractName":"Reservation","contractVersion":"1.0.0","domain":"calendar","compatibility":"minor-additive","stateMachine":{"states":["held","confirmed","released","canceled","expired"],"legalTransitions":[["held","confirmed"],["held","released"],["held","expired"],["held","canceled"],["confirmed","canceled"]]}}}
