{"id":"res_001","objectType":"Reservation","schema_version":"1.0.0","calendar_ref":{"objectType":"Calendar","objectId":"cal_001","version":1},"resource_ref":{"objectType":"Resource","objectId":"room_001","version":1},"reserved_for_ref":{"objectType":"Person","objectId":"person_01HZY7R3P7K7JQZ7N4W3V5Z9A1","version":1},"status":"held","start_at":"2026-08-21T15:00:00Z","end_at":"2026-08-21T16:00:00Z","timezone":"America/Los_Angeles","quantity":1,"hold_expires_at":"2026-08-20T13:15:00Z","created_at":"2026-08-20T13:00:00Z","updated_at":"2026-08-20T13:00:00Z","version":1}
